{
  "$schema": "https://json-schema.org/draft/2020-12/schema",
  "$id": "https://exam-platform.local/contracts/content-snapshot-v1.schema.json",
  "title": "Published content snapshot v1",
  "type": "object",
  "additionalProperties": false,
  "required": ["schemaVersion", "externalReleaseId", "examId", "examVersionId", "releaseVersion", "releaseStatus", "publishedAt", "checksum", "subjects"],
  "properties": {
    "schemaVersion": { "const": "1.0" },
    "externalReleaseId": { "type": "string", "minLength": 1, "maxLength": 200 },
    "examId": { "type": "string", "pattern": "^[a-z0-9]+(?:-[a-z0-9]+)*$", "example": "swedish-citizenship", "description": "Canonical lowercase kebab-case cross-service exam identifier." },
    "examVersionId": { "type": "string", "minLength": 1, "maxLength": 200 },
    "releaseVersion": { "type": "string", "minLength": 1, "maxLength": 100 },
    "releaseStatus": { "const": "PUBLISHED" },
    "publishedAt": { "type": "string", "format": "date-time" },
    "checksum": { "type": "string", "pattern": "^[a-f0-9]{64}$" },
    "subjects": {
      "type": "array",
      "minItems": 1,
      "items": {
        "type": "object",
        "additionalProperties": false,
        "required": ["id", "name", "sortOrder", "topics"],
        "properties": {
          "id": { "type": "string", "minLength": 1, "maxLength": 200 },
          "name": { "type": "string", "minLength": 1, "maxLength": 500 },
          "sortOrder": { "type": "integer", "minimum": 0 },
          "topics": {
            "type": "array",
            "minItems": 1,
            "items": {
              "type": "object",
              "additionalProperties": false,
              "required": ["id", "name", "sortOrder", "questions"],
              "properties": {
                "id": { "type": "string", "minLength": 1, "maxLength": 200 },
                "name": { "type": "string", "minLength": 1, "maxLength": 500 },
                "description": { "type": ["string", "null"] },
                "sortOrder": { "type": "integer", "minimum": 0 },
                "questions": {
                  "type": "array",
                  "minItems": 1,
                  "items": {
                    "type": "object",
                    "additionalProperties": false,
                    "required": ["id", "versionId", "knowledgeFactId", "questionType", "prompt", "explanation", "language", "active", "answerOptions"],
                    "properties": {
                      "id": { "type": "string", "minLength": 1, "maxLength": 200 },
                      "versionId": { "type": "string", "minLength": 1, "maxLength": 200 },
                      "knowledgeFactId": { "type": "string", "minLength": 1, "maxLength": 200 },
                      "questionType": { "const": "SINGLE_CHOICE" },
                      "prompt": { "type": "string", "minLength": 1 },
                      "explanation": { "type": "string", "minLength": 1 },
                      "language": { "type": "string", "minLength": 2, "maxLength": 35 },
                      "difficulty": { "type": ["string", "null"], "maxLength": 50 },
                      "active": { "type": "boolean" },
                      "answerOptions": {
                        "type": "array",
                        "minItems": 2,
                        "items": {
                          "type": "object",
                          "additionalProperties": false,
                          "required": ["id", "text", "correct", "sortOrder"],
                          "properties": {
                            "id": { "type": "string", "minLength": 1, "maxLength": 200 },
                            "text": { "type": "string", "minLength": 1 },
                            "correct": { "type": "boolean" },
                            "sortOrder": { "type": "integer", "minimum": 0 }
                          }
                        }
                      }
                    }
                  }
                }
              }
            }
          }
        }
      }
    }
  },
  "description": "SHA-256 checksum is calculated over canonical JSON serialization of the snapshot with the checksum field omitted. Object field order follows this schema and array order is significant."
}
